{
  "task": "Implement a bounded repository change and verify it end to end.",
  "context": "Each worker gets an APXM-owned detached Git worktree. Replace profile IDs with registered APXM profiles in this runtime.",
  "event": "repository goal requested",
  "trigger": "goal-loop policy admitted one bounded ACP worker pass",
  "workspace": {
    "mode": "git_worktree",
    "repo_root": "/absolute/path/to/repo",
    "base_ref": "HEAD",
    "cleanup": "keep"
  },
  "admit_capabilities": ["SPAWN_AGENT"],
  "workers": [
    {
      "id": "planner",
      "role": "Produce the concrete implementation plan and risks.",
      "profile": "planner-profile",
      "transport": "acp",
      "prompt": "Plan the change. Do not edit files. Return exact files, tests, and constraints."
    },
    {
      "id": "executor",
      "role": "Implement the accepted bounded change in your own worktree.",
      "profile": "executor-profile",
      "transport": "acp",
      "depends_on": ["planner"],
      "prompt": "Implement the change in your assigned worktree. Return changed files and tests run."
    },
    {
      "id": "critic",
      "role": "Critique the implementation and preserve dissent.",
      "profile": "critic-profile",
      "transport": "acp",
      "depends_on": ["executor"],
      "prompt": "Review the change for correctness, policy risk, missing evidence, and regressions."
    },
    {
      "id": "verifier",
      "role": "Verify behavior independently in your own worktree.",
      "profile": "verifier-profile",
      "transport": "acp",
      "depends_on": ["executor", "critic"],
      "prompt": "Run focused checks and report evidence, blockers, and follow-up recommendations."
    }
  ],
  "supervisor": {
    "id": "gate",
    "transport": "deterministic",
    "prompt": "Evaluate worker outputs, decide pass/needs_more/blocked/unsafe, and emit feedback for another bounded pass only when required."
  }
}
