{
  "task": "Design and verify a small APXM workflow improvement.",
  "context": "Deterministic example; no external agents or API keys are required.",
  "event": "manual orchestration smoke test",
  "trigger": "developer requested a dry local demonstration",
  "workspace": {
    "mode": "session"
  },
  "workers": [
    {
      "id": "planner",
      "role": "Split the implementation into bounded steps."
    },
    {
      "id": "executor",
      "role": "Describe the concrete implementation path."
    },
    {
      "id": "verifier",
      "role": "List the tests and failure modes to cover."
    }
  ]
}
